,job_title,job_company,job_location,job_seniority,job_category,job_employment_type,job_salary_range_from,job_salary_range_to,job_salary_type,job_details_url,job_description,job_requirements
0,"Associate, Data Science",LAZADA SOUTH EAST ASIA PTE. LTD.,Central,Executive,Information Technology,Permanent,"$4,000","$7,000",Monthly,https://www.mycareersfuture.sg/job/associate-data-science-lazada-south-east-asia-ac8f57845b931abf5ac45d259f164ac6,"<p><u>Team Introduction</u></p><p>Lazada is the number one online shopping &amp; selling destination in Southeast Asia – present in Indonesia, Malaysia, the Philippines, Singapore, Thailand and Vietnam. Lazada helps more than 80,000 local and international sellers as well as 2,500 brands serve the 560 million consumers in the region through its marketplace platform, supported by a wide range of tailored marketing, data, and service solutions. Lazada offers an excellent customer experience through a wide network of logistics partners and its own first- and last-mile delivery arm.</p><p><u>Responsibilities</u></p><p>As a Lazada data scientist, you will face different challenges. You will be applying different techniques such as deep learning, reinforcement learning, natural language processing and operational research to solve real world problems. You will be:</p><ul> 	<li>Responsible for recommendation frameworks and algorithms for products, product topics, sellers, and feeds stream by item quality control and online personalization.</li> 	<li>Responsible for developing audience, content and bidding algorithms for digital marketing on channels, and help engage our customers better by notifications.</li> 	<li>Responsible for campaign operation algorithms for seller and product recruiting, product scheduling, stock prediction, pricing strategy, and onsite recommendations.</li> 	<li>Responsible for ecommerce knowledge representations, quality controlling and caring for product, category, seller and reviews; natural language processing for opinion mining and text generation.</li> </ul>","<ul> 	<li>At least two years relevant working experience;</li> 	<li>Masters or PhD degree in computer science, operations research, statistics, mathematics, or equivalent fields;</li> 	<li>Solid theoretical foundations and industry experiences in machine learning, natural language processing, personalized search &amp; recommendation, user/seller behavior modeling, sales prediction, knowledge graph and representation, marketing algorithm, large scale data analysis/platforms;</li> 	<li>Expertise in deep learning, reinforcement learning, explore &amp; exploit algorithms, control theory is preferred;</li> 	<li>Experience in machine learning libraries such as Tensorflow, Keras, Theano, etc;</li> 	<li>Solid programming skills in SQL, Java, Python and Scala;</li> 	<li>Passionate about technology, demonstrate ability to generate new ideas and innovations; excellent in self-learning, problem analyzing and solving; work independently, proactive, strong teamwork spirit;</li> 	<li>Good interpersonal and communication skills, including the ability to describe the logic and implications of a complex model to stakeholders. </li> </ul>"
0,Senior Data Scientist,Company Undisclosed,South,Professional,Professional Services,Full Time,,,,https://www.mycareersfuture.sg/job/senior-data-scientist-683acf672fba65eb618df541bb0b982a,"<p>Minimum of 4-5 years’ experience with the standard data science stack -- Python, Numpy, Pandas, Scikit-Learn,</p><p>scipy, matplotlib, NLTK, etc.).</p><p>* Familiarity with (some of) Keras, Tensorflow, Theano, R, C/C++, Java, Hadoop, or Spark a plus.</p><p> </p>","<p> Experience in relevant area of scientific disciplines (e.g., machine learning, numerical methods, signal processing,</p><p>statistics, mathematics, and optimization) a plus</p><p>* Excellent oral and written communication skills essential</p><p>* Ability to function in Linux operating system and development environment.</p><p>* Master’s or equivalent degree in Science, Applied Math, Computer Science, or Engineering. Proven ability to apply analysis techniques (machine learning, applied math, statistics) in developing predictive and descriptive software models.</p>"
0,Data Scientist,ABAKUS (ASIA PACIFIC) PTE. LTD.,East,Manager ...,Banking and Finance ...,Permanent,"$4,000","$8,000",Monthly,https://www.mycareersfuture.sg/job/data-scientist-abakus-79622d8bff5f6b00843878c796d4f0ad,"<p>To reinvent an industry, you need to build an all-star team. Join Wecash if you want to leverage upon the power of big data and machine learning to design, develop, promote and operate technology and products that can provide better credit assessment of consumers and business owners to facilitate loans underwriting between institutional lenders and individuals.</p><p>Founded in 2014, we are the first Chinese startup using big data and machine learning to evaluate consumer credit and detect fraud. Our company has raised more than US$260 million in equity financing over 4 rounds, acquired over 130 million users and have underwritten more than US$8 billion in loans to transform the lifestyle and credit worthiness of individuals around the world.</p><p>Our team is over 800-strong across our offices in Greater China, North America, Latin America and Asia Pacific. We are constantly on the lookout for talent to join us on our journey to transform the consumer finance experience for consumers around the world, and invite you to start a conversation with us today.</p><p>Wecash is looking for a stellar technologist to drive our expansion in Asia Pacific. If you can understand complex technology, navigate the fintech industry and thrive under ambiguous objectives, join us as our Data Scientist in Southeast Asia, and help us grow.</p><p>Responsibilities</p><ul>   <li>Adept in the art of cleansing, manipulation, feature extraction and analysis on large data sets</li>   <li>Seek out external data sources for relevant context and combine external data with existing data to improve our credit and risk models</li>   <li>Stay on top of latest developments in big data, data mining, natural language processing, machine learning and artificial intelligence techniques and technologies, while interpreting their impact and usefulness to the financial industry</li>   <li>Design and implement machine learning-based credit and risk models and systems that can scale to serve and benefit tens of millions of customers</li>   <li>Design elegant data visualizations to present complex analysis and insights to both internal (management) and external (customers) audiences</li>   <li>Develop subsystems that facilitate performance tracking, analysis and ongoing optimization of implemented credit and risk models</li>  </ul>","<ul>   <li>A proactive and diligent technologist willing to get your hands dirty with the details while possessing an innate sensitivity to data and an appreciation of proper documentation</li>   <li>Demonstrate understanding and expertise in commonly used machine learning algorithms, feature selection techniques and data modeling processes</li>   <li>Familiar with commonly used data mining algorithms (i.e. classification, clustering, regression, association rules, neural networks, etc.) and its principles, and is able to discuss past project experiences at length</li>   <li>Accomplished in R, Python, SQL and other comparable programming languages</li>   <li>Adept at choosing between Hadoop, Storm, Spark and other comparable big data technologies depending on the context, and is able to discuss past project experiences in large-scale data and log processing</li>   <li>Doctorate in Statistics, Applied Mathematics, Computer Science or other related disciplines</li>   <li>Ready, willing and eager for the occasional travel between Singapore, China, Indonesia, Vietnam and/or India.</li>  </ul><p>Bonus Skills</p><ul>   <li>Fluency in Hindi, Punjabi or Vietnamese to communicate with India and Vietnam counterparts.</li>   <li>Banking and/or Fintech industry experience</li>  </ul>"
0,Data Scientist,DIMENSION DATA ASIA PACIFIC PTE. LTD.,East,Executive,Information Technology,Permanent,"$7,000","$8,900",Monthly,https://www.mycareersfuture.sg/job/data-scientist-dimension-data-asia-pacific-430083d7e773f8bf7bf385bb71c9f01f,"<p>Dimension Data has a vast support service portfolio that contains thousands of contracts, millions of CI across a multitude of suppliers. Dimension Data is seeking to capitalising on these vast repositories of data using advance tools to visualise such information.<br> The role of the CSM Group Systems Analyst is to ensure that all the Dimension Data Tier 1 systems and the associated underlying data is aligned to enable the CSM community to capitalise on any extracted information to drive renewal sales and cross functional programmes to enable client success.<br> The individual will work as a part of an expanding group function, looking backwards into the business as well as third parties to establish the correct data linkages between the respective systems/tools to extract the maximum value. As a team member the individual should be conversant and fluent in data manipulation in many differing formats, passionate at combining data sets, extracting information and modelling using a variety of tools to ensure greater sales opportunities are extracted.<br> We are also seeking an individual that is commercially aware; has the ability to link extracted data to solve business challenges, breaking down such challenges into discreate milestone opportunities.<br> As a global role the individual is expected to be flexible in nature, adjusting their personal work patterns at time to align to the needs of a remote region.</p><p>In this position the Group System Analyst will be required to:</p><p>Own the linkage of data between systems ensuring data accuracy and completeness, aligned to the business time lines for data delivery Ensure data is manipulated, extracted and loaded in a timely fashion to support the business objectives Work with the respective regional data contacts to ensure accurate and timely collection and correction of any system data to ensure smooth operational effectiveness. Seek to streamline and automate as many data capture processes to enable the business to scale and grow effectively.</p><p>Provide ideas, and guidance on how best to provide performance reports for the respective regions with focus on how contract growth is performing.</p>","<p>As the Group System Analyst for Client Success, you should;</p><ul>   <li>be a problem solver, using best practices to analyse large amounts of data while maintaining intense attention to detail</li>   <li>have possess a proactive, creative approach to problem solving, paying attention to detail</li>   <li>be a good, effective communicator of complex information, in a simplistic easily digestible form (verbal and written)</li>   <li>have, build and maintain a good understanding of regional business practices, processes and data process models</li>   <li>have a working knowledge of Dimension Data regional renewal business processes and how you can influence such process to leverage the combined capabilities of the group</li>   <li>displays integrity consistently, in accordance with clear ethic and values; and can manage time effectively according to complex regional schedule</li>  </ul><p>demonstrates good leadership and coordination, as well as excellent interpersonal skills and can lead / drive change in the business successfully.</p><p> </p><p>Send your CVs to Sherine.Martin@dimensiondata.com</p>"
0,Hiring Senior Data Scientist. Direct Applicants only,ISMART SYNERGY PTE. LTD.,Central,Senior Management ...,Information Technology,Permanent ...,,,,https://www.mycareersfuture.sg/job/hiring-senior-data-scientist-direct-applicants-ismart-synergy-c9380a4157c3ab879445cf88a39fc549,"<p>To succeed in this role the candidate must possess the ability to deal with complex data integration issues, evaluate different algorithmic approaches and analyse Data to solve problems. Will provide Technical Leadership and report to the C-Suite.</p><p><strong>Key Responsibilities: </strong></p><ul>   <li>PreSales : Build Relationships with Stakeholders and turn from a Concepts/Ideas into compelling proposals that engage stakeholders and clients. Partner closely with the Business Development and Sales teams, to enable large-scale customer use cases and drive the adoption of our Solutions.</li>   <li>Analyse and build prototypes for POC stage using data science techniques</li>   <li>Work with our partners to deliver Data and Tools needed for POCs</li>   <li>Identify, clean and wrangle data.</li>   <li>Integrate internal and external data sources using APIs </li>   <li>Develop test Algorithms with tools and languages like R, Python, etc. </li>  </ul><p> </p><ul>  </ul>","<p><strong>Key Requirements: </strong></p><ul>   <li>Experience producing and rapidly delivering Prototypes and Minimum Viable Products (MVPs)</li>   <li>Building APIs or webbased prototypes</li>   <li>Big Data analytics or Visualisation experience such as: Spark Hadoop ecosystem - NoSQL DB </li>   <li>Experience in manipulating data sets and building statistical and machine learning models</li>   <li>Able to create and use advanced machine learning algorithms and statistics: regression, simulation, scenario analysis, modelling, clustering, decision trees, neural networks</li>   <li>Strong problemsolving skills and adept at using large data sets to find opportunities for optimization and using models to test the effectiveness of different courses of action.</li>   <li>A strong market research practitioner with substantial experience in analyzing data to provide recommendations and insight.</li>   <li>Experience in one or more of the following an advantage: </li>  </ul><p>               1. NLP/Data mining               </p><p>               2. Information extraction </p><p>               3. Machine learning Data Visualization</p><ul>   <li>5+ years design/implementation experience of Machine Learning/AI/Deep Learning solutions</li>   <li>Technical degree with statistical fundamentals (Masters/PhD preferred)</li>  </ul>"
0,"Data Analyst / Scientist (Tableau, SQL,Excel and VBA macro)",OPTIMUM SOLUTIONS (SINGAPORE) PTE LTD,East,Senior Management ...,Information Technology,Contract,"$5,000","$9,000",Monthly,https://www.mycareersfuture.sg/job/data-analyst-scientist-optimum-solutions-d8c62308933161e5dd2c56dc58232cc7,"<p><strong>Optimum Solutions (Company Registration Number: 199700895N), is a full spectrum Software Solutions and Services Company. Software services from Optimum are designed to deliver Enterprise Client-Server/ Multi-tier and Web based solutions across the entire value chain, spanning on-site consulting services to turnkey software projects. We started our operations in March 1997.</strong></p><p>Role- Data Analyst/Scientist (Tableau, SQL,Excel and VBA macro)</p>",<p>JD as below:</p><p>Key Responsibilities:</p><p>Primary Skills :</p><ul> 	<li>Proficient in Excel and VBA macro automation for data analysis and automation</li> 	<li>Experience in Tableau - dashboard design and development</li> </ul><p>Good excel programming </p><p> </p>
0,Senior Data Scientist (Smallholder Digital Lab),YARA ASIA PTE. LTD.,South,Professional,Information Technology,Permanent,"$9,000","$13,000",Monthly,https://www.mycareersfuture.sg/job/senior-data-scientist-yara-asia-4f824a9120c8ebcaa38865b187f17604,"<p>There are more than 500 million smallholder farms globally with at least 2 billion people depending on them for their livelihoods. In many of these segments, agricultural productivity is up to 10 times less than in developed markets.<br> <br> The smallholder focused solutions teams have the challenge to develop digital solutions with the focus on increasing productivity through optimal crop nutrition and knowledge transfer.</p><p><strong>About the Unit</strong></p><p>Digital Farming is a newly established global unit, created in Yara Crop Nutrition. With locations in Europe, Brazil, Singapore and North America we are shaping the future of farming by building new digital business models. We identify new digital products, enhance customer interaction and achieve digitally enabled functional excellence. Our aspiration is to shape Yara as the digital leader in crop nutrition.<br> <br> We build solutions for farmers, construct hardware and sensors, crunch satellite data, apply artificial intelligence, and turn research results into solutions. Our team is made of designers, software engineers, hardware developers, data scientists, solution managers and product owners.</p><p><strong>Responsibilities</strong></p><ul>   <li>Study, develop and manage the data resources of the analytics and insights side of the smallholder solutions.</li>   <li>Research new ways to interpret and utilise the data resources to provide meaningful, actionable insights.</li>   <li>Work cross-functionally with different parts of the development centre to support the data needs of different teams.</li>   <li>Develop, test and implement various scripts, algorithms and code when necessary.</li>  </ul><p><strong>Additional information</strong></p><p>We encourage all qualified applicants from all background to apply and are committed to creating a work environment that fits gender equality and allows combining career progress with the needs of a family or other personal circumstances.</p><p><strong>Why us?</strong></p><ul>   <li>Well funded, supported and staffed corporate innovation hub which offers a balance between startup culture and corporate support and benefits </li>   <li>Direct impact on products, which provide real value to farmers</li>   <li>Work on sustainable solutions that benefit mankind and the environment</li>   <li>Unlimited working contract and competitive remuneration + benefits</li>   <li>Support for personal development, training and continuous learning</li>   <li>Commitment to using new technologies and frameworks, in-house hackathons, meetups, and knowledge sharing</li>  </ul>","<ul> 	<li>At least ten data science projects completed from start to finish.</li> 	<li>Strong personal/professional interest in the LSM segments (developing countries, low-income markets, etc) and agriculture in general.</li> 	<li>Strong experience in Python and Javascript. Knowledge of statistical packages like R Studio, SPSS, etc.</li> 	<li>Comfortable working with our tools: AWS, GitLab, Jenkins, Jira, Docker</li> 	<li>Aligned with our principles: agile, customer-centric, lean, service-oriented architecture, self-organization, transparency.</li> </ul>"
0,Manager (Concise),IRISNATION SINGAPORE PTE. LTD.,Central,Manager,Advertising / Media ,Full Time,"$5,000","$7,500",Monthly,https://www.mycareersfuture.sg/job/manager-irisnation-singapore-bccaca78292b3cb32a086afcb54abb03,"<p><strong>Is this you?</strong></p><p>We’re looking for a strong data analyst, capable of turning a wealth of data into insights that can be used to increase the business impact of CRM, both through retention of existing customers and acquisition from competitors. The right candidate will be a self-motivated individual, capable of both working independently and leading workstreams, as well as collaborating as part of a team.</p><p>You’ll be working as part of a cross-agency team (data, strategy, creative, production, operations) which is pioneering data-driven marketing for one of the biggest electronics brands in the world.</p><p>For this role, ideally, you’d have:</p><ul> 	<li>An understanding of the broader context of analytics as one pillar of data-driven marketing</li> 	<li>Experience working on CRM focussed projects</li> 	<li>Experience working with Qlik to build automated dashboards</li> </ul><p><strong>What you’ll do</strong></p><ul> 	<li>Work as part of a 10-person core team operating our client’s regional data-driven marketing program (1 x program lead, 4 x analysts, 5 x execution specialists)</li> 	<li>Lead the delivery of regular insight deliverables (with the support and guidance of a Senior Data Scientist), producing exploratory analysis which informs business / marketing strategy and campaigns</li> 	<li>Measure the effectiveness and business impact of marketing activities, and provide recommendations as to how activities should be optimised</li> 	<li>Be responsible for consistently and proactively producing interesting and unexpected insights to our clients, positioning Iris Concise as a leader in data-driven marketing</li> 	<li>Likely be 80% - 100% focussed on a single client for the first 6 months of your role</li> </ul>","<p><strong>What we’re looking for…</strong></p><p><strong>For this role you must have:</strong></p><ul> 	<li>Strong, hands-on experience in advanced analytics using SQL or similar</li> 	<li>Experience in designing, developing, and applying advanced analytics solutions to commercial and marketing challenges</li> 	<li>Experience owning the design and development of analytical projects</li> 	<li>The ability to describe analytics and its outputs in a manner which is clearly understood by those without a working knowledge of data</li> 	<li>Be capable of presenting data outputs to senior clients</li> 	<li>A Bachelors / Masters degree (likely to be in the Economics, Mathematics, or other numerate fields) with 3-5 years of work experience</li> </ul><p> </p>"
0,Data Scientist,Company Undisclosed,South,Senior Executive,Information Technology,Permanent,"$7,000","$15,000",Monthly,https://www.mycareersfuture.sg/job/data-scientist-0631990f154f4fd60c8e07712044df0a,"<ul>   <li>Develop AI Algorithm, Deep Learning/Neural Network models</li>   <li>Fast research and learn business scenarios and apply relevant methodology to solve business needs</li>   <li>Fast learner to understand existing risk models of sister company in China and conduct customization to fit into local markets</li>   <li>Good understanding of banking and finance businesses</li>   <li>Liaise with Risk Data Architecture manager for acquiring relevant data for modeling purpose, including searching for external data sources, data crawling, etc. </li>   <li>Collaborate with application development team (in-house or outsource) for planning and the implementation of the models into the products</li>   <li>Gathering feedbacks and plan for model improvements and better customer experience on a regular basis.</li>   <li>Lead a team and coordinate resources to achieve short-term，mid-term and long-term objectives</li>  </ul>","<ul>   <li>More than 5 years (10 years for Senior Manager) data analytics</li>   <li>Knowledge of the latest development of about Artificial Intelligence(AI), big data analytics, Knowledge Graph and other technologies</li>   <li>Experienced in the development distributed data storage, computing, Hadoop, Spark, cloud computing and relevant big data technologies</li>   <li>Experienced in Natural Language Processing (NLP), especially English and Chinese. Other ASEAN languages are a plus</li>   <li>Experienced in at least two of: R. Python, SQL</li>   <li>Experience with deep learning frameworks, e.g. Theano, TensorFlow, Caffe, Keras is a plus</li>   <li>Have clear and comprehensive understanding of AI technology development, and implement into business scenarios</li>   <li>Experienced in team management, strong communication skills and organizational coordination ability</li>   <li>Equipped with good professional integrity, highly responsible for work, ability to undertake work pressure and challenges</li>   <li>English and Mandarin fluency is a must, Indonesian or Vietnamese language is a plus</li>  </ul>"
