,job_title,job_company,job_location,job_seniority,job_category,job_employment_type,job_salary_range_from,job_salary_range_to,job_salary_type,job_details_url,job_description,job_requirements
0,Mid Level Data Scientist,TRAVELOKA SERVICES PTE. LTD.,Central,Executive,Information Technology,Permanent,"$4,300","$7,600",Monthly,https://www.mycareersfuture.sg/job/mid-level-data-scientist-traveloka-services-070cc8d4566a789df5bafa56b32c845f,"<p>As a Data scientist, you will be applying machine learning techniques such as deep learning, reinforced learning, decision tree learning and other techniques to solve complex problems and drive insights from our sea of data.</p><p>You will be responsible for:</p><ul>   <li>Analyzing large, complex datasets into actionable insights</li>   <li>Use data to solve complex problems which are pivotal to our business</li>   <li>Effectively conceptualize analysis to internal stakeholders</li>   <li>Conduct advanced statistical analysis</li>   <li>Develop practical algorithms and frameworks to optimize Traveloka’s capabilities</li>  </ul><p>Working in Traveloka:</p><ul>   <li>You will work in cross-functional teams and meet great people regularly from top tier technology, consulting, product, or academic background. </li>   <li>We work in open environment where there are no boundaries or power distance. </li>   <li>Everyone is encouraged to speak their mind, propose ideas, influence others, and continuously grow themselves. </li>   <li>Get the exposure to multi-aspect, collaborative, intensive startup experience with our recent expansion into Southeast Asia and exploration of new products. <br>  </li>  </ul>","<ul> 	<li>Solid programming skills and understanding of statistical models</li> 	<li>Bachelors/Masters/PhD degree from top universities in a quantitative field (Physics, Mathematics, Computer Science, Engineering, etc.)</li> 	<li>3+ years of relevant experience in Advance Analytics</li> 	<li>Experienced in tools such as: R, python, MATLAB and etc</li> 	<li>Experienced in machine learning libraries such as: Tensorflow, Theano, Keras, Scikit-learn, SciPy and etc.</li> 	<li>Solid analytical and problem solving skills to create data-driven insights</li> 	<li>Passion in big data<br> 	 </li> </ul>"
0,Junior - Mid Level Data Scientist,TRAVELOKA SERVICES PTE. LTD.,Central,Fresh/entry level,Information Technology,Permanent,"$3,000","$6,000",Monthly,https://www.mycareersfuture.sg/job/junior-mid-level-data-scientist-traveloka-services-cb235c2f3ed0e380988dcd1e4c3430be,"<p>As a Data scientist, you will be applying machine learning techniques such as deep learning, reinforced learning, decision tree learning and other techniques to solve complex problems and drive insights from our sea of data.</p><p>You will be responsible for:</p><ul>   <li>Analyzing large, complex datasets into actionable insights</li>   <li>Use data to solve complex problems which are pivotal to our business</li>   <li>Effectively conceptualize analysis to internal stakeholders</li>   <li>Conduct advanced statistical analysis</li>   <li>Develop practical algorithms and frameworks to optimize Traveloka’s capabilities</li>  </ul><p>Working in Traveloka:</p><ul>   <li>You will work in cross-functional teams and meet great people regularly from top tier technology, consulting, product, or academic background. </li>   <li>We work in open environment where there are no boundaries or power distance. </li>   <li>Everyone is encouraged to speak their mind, propose ideas, influence others, and continuously grow themselves. </li>   <li>Get the exposure to multi-aspect, collaborative, intensive startup experience with our recent expansion into Southeast Asia and exploration of new products. <br>  </li>  </ul>","<ul> 	<li>Solid programming skills and understanding of statistical models</li> 	<li>Bachelors/Masters/PhD degree from top universities in a quantitative field (Physics, Mathematics, Computer Science, Engineering, etc.)</li> 	<li>Fresh graduates with internship experience - 3+ years of relevant experience</li> 	<li>Experienced in tools such as: R, python, MATLAB and etc</li> 	<li>Experienced in machine learning libraries such as: Tensorflow, Theano, Keras, Scikit-learn, SciPy and etc.</li> 	<li>Solid analytical and problem solving skills to create data-driven insights</li> 	<li>Passion in big data<br> 	 </li> </ul>"
0,Senior Data Scientist,EXPERIAN SINGAPORE PTE. LTD.,East,Junior Executive,Information Technology,Full Time,"$100,000","$130,000",Annually,https://www.mycareersfuture.sg/job/senior-data-scientist-experian-singapore-90a1ef4097f1ef00408dcf57f80a561a,"<p><u>Role:</u></p><ul>   <li>Data scientist with hands on <strong>expertise in building and executing analytics modules</strong> on various technology platforms including big data technology platforms.</li>   <li>Successful candidates are intellectually curious builders who are biased toward action, scrappy, and communicative.</li>   <li>Own and complete work streams for execution and delivery.</li>   <li>Be able to compile results from various work streams and be able to make coherent presentations to internal and external stakeholders.</li>   <li>Experience in building or <strong>managing data products</strong>, high performer and problem solver.</li>   <li>Applying best practices to manage solution implementations including code design and reviews</li>  </ul><p> </p>","<p><u>Skillset:</u></p><ul>   <li><strong>MS or PhD in Computer Science</strong>, Computer Engineering, <strong>Mathematics, Statistics</strong> or a related field with solid exposure to Machine Learning and/or Advanced Analytics with 3+ years of experience in predictive analytics and exposure to big data analytics</li>   <li>Strong understanding of the <strong>financial domain or risk domain</strong>. Desired domain expertise in Credit Risk, Telecom Analytics, Retail analytics</li>   <li>Strong coding skills in <strong>Python is a must, and in other languages like R and SQL, Hive Sql</strong></li>   <li>Hands-on experience with Python libraries - <strong>NumPy, Pandas, sklearn</strong></li>   <li>Hands-on knowledge of working with scalable platforms for processing large and/or complex multi-source <strong>data sets using Hive, Hadoop or Spark (PySpark) is a plus.</strong></li>   <li>Comfortable with working on <strong>Unix, Windows and databases</strong> like Elastic Search and MongoDB</li>   <li>Sound knowledge of <strong>machine learning concepts</strong>. Illustrative machine learning methodologies are:    <ul>     <li>Bagging, Boosting, Regularization, Online Learning, One Hot Encoder etc.</li>     <li>Statistical modeling – CHAID, CART, Regressions, SVM, SVD etc.</li>    </ul> </li>   <li>Experience on the text analytics stack – NLP, NLU, LDA, TF-IDF etc.</li>   <li>Ability to <strong>communicate analytics-based insights</strong> to business stakeholders. Independent problem solver comfortable to work in an ambiguous solution space. Strong PPT Skills, Excel skills</li>   <li>Demonstrated experience in delivering analytics projects in high pressure environments</li>   <li>Role based in Singapore with 20% travel in APAC</li>  </ul>"
0,Senior Data Scientist,EXPERIAN SINGAPORE PTE. LTD.,East,Junior Executive,Information Technology,Full Time,"$130,000","$160,000",Annually,https://www.mycareersfuture.sg/job/senior-data-scientist-experian-singapore-921a1e6b5876a1b05b221e7e657318e4,"<p><u>Role:</u></p><ul>   <li>Data scientist with hands on <strong>expertise in building and executing analytics modules</strong> on various technology platforms including big data technology platforms.</li>   <li>Successful candidates are intellectually curious builders who are biased toward action, scrappy, and communicative.</li>   <li>Own and complete work streams for execution and delivery.</li>   <li>Be able to compile results from various work streams and be able to make coherent presentations to internal and external stakeholders.</li>   <li>Experience in building or <strong>managing data products</strong>, high performer and problem solver.</li>   <li>Applying best practices to manage solution implementations including code design and reviews</li>  </ul><p> </p>","<p><u>Skillset:</u></p><ul>   <li><strong>MS or PhD in Computer Science</strong>, Computer Engineering, <strong>Mathematics, Statistics</strong> or a related field with solid exposure to Machine Learning and/or Advanced Analytics with 3+ years of experience in predictive analytics and exposure to big data analytics</li>   <li>Strong understanding of the <strong>financial domain or risk domain</strong>. Desired domain expertise in Credit Risk, Telecom Analytics, Retail analytics</li>   <li>Strong coding skills in <strong>Python is a must, and in other languages like R and SQL, Hive Sql</strong></li>   <li>Hands-on experience with Python libraries - <strong>NumPy, Pandas, sklearn</strong></li>   <li>Hands-on knowledge of working with scalable platforms for processing large and/or complex multi-source <strong>data sets using Hive, Hadoop or Spark (PySpark) is a plus.</strong></li>   <li>Comfortable with working on <strong>Unix, Windows and databases</strong> like Elastic Search and MongoDB</li>   <li>Sound knowledge of <strong>machine learning concepts</strong>. Illustrative machine learning methodologies are:    <ul>     <li>Bagging, Boosting, Regularization, Online Learning, One Hot Encoder etc.</li>     <li>Statistical modeling – CHAID, CART, Regressions, SVM, SVD etc.</li>    </ul> </li>   <li>Experience on the text analytics stack – NLP, NLU, LDA, TF-IDF etc.</li>   <li>Ability to <strong>communicate analytics-based insights</strong> to business stakeholders. Independent problem solver comfortable to work in an ambiguous solution space. Strong PPT Skills, Excel skills</li>   <li>Demonstrated experience in delivering analytics projects in high pressure environments</li>   <li>Role based in Singapore with 20% travel in APAC</li>  </ul>"
0,"Data Science manager, Global Lifecycle Analytics",PAYPAL PTE. LTD.,Central,Professional,Others,Permanent,"$7,750","$11,667",Monthly,https://www.mycareersfuture.sg/job/data-science-manager-global-lifecycle-analytics-paypal-4ba83fc091b790a9d55fef9016dbb8ed,"<p>PayPal is seeking a business-savvy and action-oriented Data Scientist to join its Marketing Analytics team as Data Science Manager for Customer Lifecycle analytics. In this role, you will be responsible for leading data science activities to increase the adoption and conversation of marketing effort through the customer lifecycle across consumer and merchant segments. Your core responsibility will be to lead, support, and provide recommendations across some of the most challenging data scientists projects such as the development of incremental response marketing models. You will collaborate with the customer lifecycle business and analytics teams and be the single point of contact towards all data scientist related activities for customer lifecycle.</p><p>This rare opportunity for a stellar data science professional involves creative freedom in generating global models to solve variate marketing problems and influence the organization on data models adoption to improve business performance. This highly visible role will make a significant contribution to the growth of our global business.</p><p><strong>What you will do:</strong></p><ul> 	<li>Design, optimize, support new and existing data models for customer lifecycle with focus on uplift/incremental response models.</li> 	<li>Data discovery activities across new topics of analyze</li> 	<li>Drive the adoption of real-time ML models</li> 	<li>Use cutting-edge analytics and solid business judgment to identify, prioritize, structure and solve complex business problems</li> 	<li>Perform deep-dive descriptive and predictive analysis on very large, complex, multi-dimensional datasets</li> 	<li>Present recommendations to senior-level executives and measure effectiveness of recommendations by monitoring their impact</li> </ul>","<p><strong>Who we are looking for:</strong></p><ul> 	<li>You are a expert with exceptional analytical and problem-solving capabilities, not a data monkey</li> 	<li>You have a passion for problem-solving and the hunger to constantly ask “why?”</li> 	<li>You are creative, love ambiguity and thrive by driving financial results and improving customer experiences</li> 	<li>You have high energy, excellent communication skills and strong executive presence</li> 	<li>You have strong business judgment and the ability to take ambiguous business problems and solve them in a structured, hypothesis-driven, data-supported way</li> </ul><p> <strong>Technical requirements:</strong></p><ul> 	<li>At least 4 years of practical experience in one or more approaches such as Random Forest, Neural Networks, Support Vector Machines, Gradient Boosting, Bayesian Networks, Deep Learning</li> 	<li>Significant experience analyzing complex, multi-dimensional data sets using SQL, Hadoop/Hive, SAS, R and/or Python</li> 	<li>Deep knowledge of statistics (e.g., multivariate statistics, regression modelling, predictive modeling, controlled test design, time-series modeling) a required</li> 	<li>Hands-on experience in one or more of the following areas:  multi-channel marketing, customer segmentation, lifecycle /funnel analytics, LTV analysis, predictive modeling</li> </ul><p><strong>Education &amp; Work Experience Requirements:</strong></p><ul> 	<li>MBA or quantitative PhD/MS degree from a top-tier institution is required</li> 	<li>Experience in end-to-end lifecycle analytics or a top-tier strategy consulting (BCG, Bain, McKinsey etc) is a strong plus</li> 	<li>Significant work experience gained in related fields such as marketing analytics, product management, finance, management consulting, or within a technology organization is required</li> </ul>"
0,Data Scientist,EYEOTA PTE. LTD.,East,Manager ...,Information Technology,Full Time,"$8,000","$16,000",Monthly,https://www.mycareersfuture.sg/job/data-scientist-eyeota-f98e5aa9e8d1078c1a26ffc33b69e923,"<p>Eyeota is looking for an exceptional Data Scientist who can contribute to building a world class  Machine Learning product pipeline based on our petabyte-scale data platform. This person will be involved in:</p><ol>   <li>Initial data mining and research, especially on up and coming technologies and algorithms</li>   <li>Model prototyping (Feature engineering, Parameter Tuning, Hyper Parameter Tuning)</li>   <li>Model development</li>   <li>Partnering with Data Engineers and Dev Ops for Model deployment into production environment</li>   <li>Ongoing monitoring of system performance</li>   <li>Exploratory research to identify new avenues to monetise existing products</li>  </ol><p>The candidate should have significant experience developing and operating a modern data pipeline platform and should have a keen interest in Machine Learning and Data Science.</p>","<p><strong>You:</strong></p><ol>   <li>2+ years experience developing ML software in a commercial, production environment</li>   <li>Strong programming skills in one or more of Golang/Python/Clojure/Java/C++/Scala</li>   <li>Hands-on experience with NLP, mining of structured, semi-structured, and unstructured data, especially with respect to classification problems</li>   <li>In depth and intuitive understanding of machine learning algorithms, with a key focus on unsupervised learning, clustering and graph processing techniques</li>   <li>In-depth and intuitive understanding of probability and statistics with a key focus on Bayesian Inference</li>   <li>Experience with machine learning tools and libraries such as Scikit-learn, gensim, TensorFlow</li>   <li>Intuition about algorithms, system performance and throughput</li>   <li>Strong interpersonal, written, and verbal communication skills</li>   <li>Ability to effectively function in a fast-paced environment with shifting priorities and simultaneous projects</li>   <li>Impeccable understanding of probability and statistics with a key focus on Bayesian Inference</li>  </ol><p>Additional skills which would be desirable but not necessary:</p><ol>   <li>Experience with Apache Storm, Spark, Flink, Solr/Lucene, Elasticsearch, Cassandra, Kafka and related distributed data processing technologies</li>   <li>Experience with multilingual NLP models</li>   <li>Architecture and system/pipeline layout experience</li>   <li>Deep Learning techniques</li>   <li>Exposure to one or more modern ML tech stacks: Spark ML-Lib, Tensorflow, Keras, GCP ML Stack, AWS Sagemaker</li>  </ol>"
0,Data Scientist,NIOMETRICS (PTE.) LTD.,East,Professional,Information Technology,Permanent,"$5,000","$10,000",Monthly,https://www.mycareersfuture.sg/job/data-scientist-niometrics-2287834674ff1ebb0c55480ec9633208,"<p><strong>WHAT WE DO</strong></p><p>Niometrics captures, organises and extracts insights from some of the biggest and most complicated datasets that our modern societies currently produce. We put a magnifying glass on the realities collectively constructed by billions of connected individuals and machines, making sense of how humanity is re-creating wholly new digital universes with bits and bytes – universes that need to be seen, interpreted and explained. From taking deep dives into digital behaviours, to exploring the most intimate interactions between network technology and user experiences, we do it all.</p><p>Our Data Science team consists of ambitious, creative and passionate individuals, united in the common goal of making a difference. With millions of users generating hundreds of TBs of data daily, our day-to-day job becomes an adventure of connecting digital signals with real-life habits to formulate granular audience insights – who they are, how they behave, and ultimately, how we can expect them to behave in the future. The action does not stop there – we also take pride in working with the latest high-end hardware and world-class software architecture. This means there are virtually no limits to the scope of future events we can model, giving us insights on not just people, but also the entire inter-connected ecosystem to which they belong.</p><p>We are perfectionists and we do not hide it. You will join a thrilling environment, implementing and deploying data science solutions that are both efficient and secure, setting the basis for a groundbreaking software platform for the long run.</p><p><br> <strong>YOUR ROLE AS DATA SCIENTIST</strong></p><p>As a Data Scientist, you will work end-to-end, leading entire projects and owning their outcomes through their entire lifecycle. You will formulate hypotheses on structured and unstructured data, design experiments, draw meaningful conclusions and effectively communicate the results to business stakeholders. You will be part of a relentless team, curious to extract the highest value possible in the most effective way. You will put into action your machine learning skills, and together, we will build optimum algorithms for regression, classification, clustering, and information extraction.</p>","<p><strong>WHAT WE VALUE</strong></p><ul>   <li>BA/BS (or MA/MS) or equivalent experience in applied Data Science.</li>   <li>Proficiency in statistical packages and ML libraries for both big and not so big data (e.g. Python SciPy ecosystem, NLTK, Tensorflow or equivalent, Spark ML and MLlib, etc.)</li>   <li>In depth knowledge of cutting-edge machine learning algorithms, as well as the strengths and weaknesses of the different methods and algorithms on different applications.</li>   <li>Experience in Unix systems and scripting in bash.</li>   <li>Proficiency in code optimisation (knowledge of Cython or similar)</li>  </ul>"
0,Lead Data Scientist,REDMART LIMITED,West,Professional,Engineering ...,Permanent ...,"$7,000","$14,000",Monthly,https://www.mycareersfuture.sg/job/lead-data-scientist-redmart-42b2188589df2e543860055aeb5722d6,"<p>As one of the fastest growing e-commerce and logistics companies in Asia, RedMart is a part of Alibaba-backed Lazada, Southeast Asia’s leading online shopping and selling platform, and we offer an unparalleled scaling a startup experience. We’re focused on always improving our customer experience and achieving our mission: To save our customers time and money for the important things in life!</p><p>We are looking for a Lead Data Scientist who cares deeply about customers and users to help develop the next generation of search and personalization at RedMart. You will build data mining systems to tackle hard problems in understanding and predicting consumer behavior to offer items to customers which are most relevant to them.</p><p>You will work with engineers, product managers and designers to develop innovative new technologies and data driven features and products. You will also work closely with other Data Scientists to collaborate on projects and share techniques and learnings. If you enjoy working with data to build products and solve hard problems in surprisingly creative ways, this is the role for you.</p><ul>  </ul>","<p><strong>Qualifications:</strong></p><ul>   <li>Deep expertise in search, preferably in e-commerce. Excellent knowledge on improving search incrementally as well as making step-changes such as applying NLP, text mining, etc.</li>   <li>Proven track record building robust search systems and achieving strong results</li>   <li>Expertise in personalization and recommender systems</li>   <li>Able to guide a team of engineers to identify and break down necessary architecture and services to support search and personalization services</li>   <li>Able to guide and work well with a team of engineers to implement Machine Learning algorithms and models, as well as implementing necessary software</li>   <li>Solid understanding of search metrics and implementing tracking to measure performance</li>   <li>Solid understanding of search engines and utilizing features effectively. Familiarity with ElasticSearch is a plus</li>   <li>Hands-on experience developing and implementing Machine Learning algorithms and models. Background in Machine Learning,Statistics &amp; Information Retrieval</li>   <li>Design, implement, test robust technical solutions that our high traffic site/apps can rely on</li>   <li>Write clean code that’s testable, maintainable, solves the right problem and does it well. Code you can be proud of.</li>   <li>Phd, Masters, or equivalent experience in a quantitative field (computer science, physics, mathematics, bioinformatics, etc.) a plus, but by no means a must</li>   <li>Experience programming in functional languages (Scala,Golang,Haskell, Clojure etc.) a plus but not a must</li>   <li>Knowledge of scripting languages like  Python/R, familiarity with web frameworks a plus</li>   <li>Experience with Java and/or Scala and microservices is a plus</li>   <li>Understanding of A/B testing</li>  </ul><p> </p><p> </p><p><strong>Desired Skills:</strong></p><ul>   <li>Able to be a key influencer in the team’s strategy and contribute significantly to team planning, showing good judgement making technical trade-offs between the team’s short term and long term business needs, and the needs of the company as a whole</li>   <li>Strong team player: Superb communication skills, thrives in a collaborative environment and be committed to the success of the team as a whole.</li>   <li>Critical thinking: ability to track down complex data and engineering issues, evaluate different algorithmic approaches, and analyze data to solve problems</li>   <li>Creativity: you can conceive of new data driven products, features, and technologies</li>   <li>Results: you prioritize, focusing on ideas and features that will have significant, measurable impact</li>   <li>Planning &amp; estimation: ability to set and meet your own project objectives &amp; milestones</li>   <li>Communicate results and progress internally and externally in meetings, presentations, and tech talks</li>   <li>Passion for technology. Our developers are always evaluating new tools and technologies that can make us better. What has attracted your interest lately?</li>  </ul>"
